[
  {
    "id": "brain-function:episodic-memory",
    "name": "Episodic memory",
    "category": "memory",
    "status": "active",
    "provenance": {
      "createdAt": "2026-09-14T00:00:00Z",
      "createdBy": "NeuroAtlas curation v1 (AI-assisted draft; pending human review)",
      "method": "manual curation from primary literature; DOIs verified 2026-09-14"
    },
    "aliases": [
      "declarative memory (episodic)"
    ]
  },
  {
    "id": "brain-function:spatial-navigation",
    "name": "Spatial navigation",
    "category": "cognitive",
    "status": "active",
    "provenance": {
      "createdAt": "2026-09-14T00:00:00Z",
      "createdBy": "NeuroAtlas curation v1 (AI-assisted draft; pending human review)",
      "method": "manual curation from primary literature; DOIs verified 2026-09-14"
    },
    "aliases": [
      "spatial memory",
      "wayfinding"
    ]
  },
  {
    "id": "brain-function:vision",
    "name": "Vision",
    "category": "sensory",
    "status": "active",
    "provenance": {
      "createdAt": "2026-09-14T00:00:00Z",
      "createdBy": "NeuroAtlas curation v1 (AI-assisted draft; pending human review)",
      "method": "manual curation from primary literature; DOIs verified 2026-09-14"
    },
    "aliases": [
      "visual perception"
    ]
  },
  {
    "id": "brain-function:voluntary-movement",
    "name": "Voluntary movement",
    "category": "motor",
    "status": "active",
    "provenance": {
      "createdAt": "2026-09-14T00:00:00Z",
      "createdBy": "NeuroAtlas curation v1 (AI-assisted draft; pending human review)",
      "method": "manual curation from primary literature; DOIs verified 2026-09-14"
    },
    "aliases": [
      "skeletomotor control"
    ]
  },
  {
    "id": "brain-function:fear-processing",
    "name": "Fear processing",
    "category": "affective",
    "status": "active",
    "provenance": {
      "createdAt": "2026-09-14T00:00:00Z",
      "createdBy": "NeuroAtlas curation v1 (AI-assisted draft; pending human review)",
      "method": "manual curation from primary literature; DOIs verified 2026-09-14"
    },
    "aliases": [
      "threat processing",
      "fear conditioning"
    ]
  },
  {
    "id": "brain-function:facial-emotion-recognition",
    "name": "Recognition of emotion from facial expressions",
    "category": "affective",
    "status": "active",
    "provenance": {
      "createdAt": "2026-09-14T00:00:00Z",
      "createdBy": "NeuroAtlas curation v1 (AI-assisted draft; pending human review)",
      "method": "manual curation from primary literature; DOIs verified 2026-09-14"
    }
  },
  {
    "id": "source:scoville-milner-1957",
    "sourceType": "primary_research",
    "title": "Loss of recent memory after bilateral hippocampal lesions",
    "authors": [
      "Scoville WB",
      "Milner B"
    ],
    "year": 1957,
    "citation": "Scoville WB, Milner B (1957). J Neurol Neurosurg Psychiatry 20(1):11-21.",
    "url": "https://doi.org/10.1136/jnnp.20.1.11",
    "externalIdentifiers": [
      {
        "namespace": "DOI",
        "identifier": "10.1136/jnnp.20.1.11"
      }
    ],
    "provenance": {
      "createdAt": "2026-09-14T00:00:00Z",
      "createdBy": "NeuroAtlas curation v1 (AI-assisted draft; pending human review)",
      "method": "manual curation from primary literature; DOIs verified 2026-09-14"
    }
  },
  {
    "id": "source:squire-zola-morgan-1991",
    "sourceType": "systematic_review",
    "title": "The medial temporal lobe memory system",
    "authors": [
      "Squire LR",
      "Zola-Morgan S"
    ],
    "year": 1991,
    "citation": "Squire LR, Zola-Morgan S (1991). Science 253(5026):1380-1386.",
    "url": "https://doi.org/10.1126/science.1896849",
    "externalIdentifiers": [
      {
        "namespace": "DOI",
        "identifier": "10.1126/science.1896849"
      }
    ],
    "provenance": {
      "createdAt": "2026-09-14T00:00:00Z",
      "createdBy": "NeuroAtlas curation v1 (AI-assisted draft; pending human review)",
      "method": "manual curation from primary literature; DOIs verified 2026-09-14"
    }
  },
  {
    "id": "source:zola-morgan-1986",
    "sourceType": "primary_research",
    "title": "Human amnesia and the medial temporal region: enduring memory impairment following a bilateral lesion limited to field CA1 of the hippocampus",
    "authors": [
      "Zola-Morgan S",
      "Squire LR",
      "Amaral DG"
    ],
    "year": 1986,
    "citation": "Zola-Morgan S, Squire LR, Amaral DG (1986). J Neurosci 6(10):2950-2967.",
    "url": "https://doi.org/10.1523/JNEUROSCI.06-10-02950.1986",
    "externalIdentifiers": [
      {
        "namespace": "DOI",
        "identifier": "10.1523/JNEUROSCI.06-10-02950.1986"
      }
    ],
    "provenance": {
      "createdAt": "2026-09-14T00:00:00Z",
      "createdBy": "NeuroAtlas curation v1 (AI-assisted draft; pending human review)",
      "method": "manual curation from primary literature; DOIs verified 2026-09-14"
    }
  },
  {
    "id": "source:rempel-clower-1996",
    "sourceType": "primary_research",
    "title": "Three cases of enduring memory impairment after bilateral damage limited to the hippocampal formation",
    "authors": [
      "Rempel-Clower NL",
      "Zola SM",
      "Squire LR",
      "Amaral DG"
    ],
    "year": 1996,
    "citation": "Rempel-Clower NL, Zola SM, Squire LR, Amaral DG (1996). J Neurosci 16(16):5233-5255.",
    "url": "https://doi.org/10.1523/JNEUROSCI.16-16-05233.1996",
    "externalIdentifiers": [
      {
        "namespace": "DOI",
        "identifier": "10.1523/JNEUROSCI.16-16-05233.1996"
      }
    ],
    "provenance": {
      "createdAt": "2026-09-14T00:00:00Z",
      "createdBy": "NeuroAtlas curation v1 (AI-assisted draft; pending human review)",
      "method": "manual curation from primary literature; DOIs verified 2026-09-14"
    }
  },
  {
    "id": "source:okeefe-dostrovsky-1971",
    "sourceType": "primary_research",
    "title": "The hippocampus as a spatial map. Preliminary evidence from unit activity in the freely-moving rat",
    "authors": [
      "O'Keefe J",
      "Dostrovsky J"
    ],
    "year": 1971,
    "citation": "O'Keefe J, Dostrovsky J (1971). Brain Res 34(1):171-175.",
    "url": "https://doi.org/10.1016/0006-8993(71)90358-1",
    "externalIdentifiers": [
      {
        "namespace": "DOI",
        "identifier": "10.1016/0006-8993(71)90358-1"
      }
    ],
    "provenance": {
      "createdAt": "2026-09-14T00:00:00Z",
      "createdBy": "NeuroAtlas curation v1 (AI-assisted draft; pending human review)",
      "method": "manual curation from primary literature; DOIs verified 2026-09-14"
    }
  },
  {
    "id": "source:moser-2008",
    "sourceType": "systematic_review",
    "title": "Place cells, grid cells, and the brain's spatial representation system",
    "authors": [
      "Moser EI",
      "Kropff E",
      "Moser MB"
    ],
    "year": 2008,
    "citation": "Moser EI, Kropff E, Moser MB (2008). Annu Rev Neurosci 31:69-89.",
    "url": "https://doi.org/10.1146/annurev.neuro.31.061307.090723",
    "externalIdentifiers": [
      {
        "namespace": "DOI",
        "identifier": "10.1146/annurev.neuro.31.061307.090723"
      }
    ],
    "provenance": {
      "createdAt": "2026-09-14T00:00:00Z",
      "createdBy": "NeuroAtlas curation v1 (AI-assisted draft; pending human review)",
      "method": "manual curation from primary literature; DOIs verified 2026-09-14"
    }
  },
  {
    "id": "source:maguire-2000",
    "sourceType": "primary_research",
    "title": "Navigation-related structural change in the hippocampi of taxi drivers",
    "authors": [
      "Maguire EA",
      "Gadian DG",
      "Johnsrude IS",
      "Good CD",
      "Ashburner J",
      "Frackowiak RSJ",
      "Frith CD"
    ],
    "year": 2000,
    "citation": "Maguire EA et al. (2000). Proc Natl Acad Sci USA 97(8):4398-4403.",
    "url": "https://doi.org/10.1073/pnas.070039597",
    "externalIdentifiers": [
      {
        "namespace": "DOI",
        "identifier": "10.1073/pnas.070039597"
      }
    ],
    "provenance": {
      "createdAt": "2026-09-14T00:00:00Z",
      "createdBy": "NeuroAtlas curation v1 (AI-assisted draft; pending human review)",
      "method": "manual curation from primary literature; DOIs verified 2026-09-14"
    }
  },
  {
    "id": "source:woollett-maguire-2011",
    "sourceType": "primary_research",
    "title": "Acquiring \"the Knowledge\" of London's layout drives structural brain changes",
    "authors": [
      "Woollett K",
      "Maguire EA"
    ],
    "year": 2011,
    "citation": "Woollett K, Maguire EA (2011). Curr Biol 21(24):2109-2114.",
    "url": "https://doi.org/10.1016/j.cub.2011.11.018",
    "externalIdentifiers": [
      {
        "namespace": "DOI",
        "identifier": "10.1016/j.cub.2011.11.018"
      }
    ],
    "provenance": {
      "createdAt": "2026-09-14T00:00:00Z",
      "createdBy": "NeuroAtlas curation v1 (AI-assisted draft; pending human review)",
      "method": "manual curation from primary literature; DOIs verified 2026-09-14"
    }
  },
  {
    "id": "source:amunts-2000",
    "sourceType": "primary_research",
    "title": "Brodmann's areas 17 and 18 brought into stereotaxic space - where and how variable?",
    "authors": [
      "Amunts K",
      "Malikovic A",
      "Mohlberg H",
      "Schormann T",
      "Zilles K"
    ],
    "year": 2000,
    "citation": "Amunts K et al. (2000). NeuroImage 11(1):66-84.",
    "url": "https://doi.org/10.1006/nimg.1999.0516",
    "externalIdentifiers": [
      {
        "namespace": "DOI",
        "identifier": "10.1006/nimg.1999.0516"
      }
    ],
    "provenance": {
      "createdAt": "2026-09-14T00:00:00Z",
      "createdBy": "NeuroAtlas curation v1 (AI-assisted draft; pending human review)",
      "method": "manual curation from primary literature; DOIs verified 2026-09-14"
    }
  },
  {
    "id": "source:hubel-wiesel-1962",
    "sourceType": "primary_research",